<?xml version="1.0" encoding="utf-8"?>
<CharacterClasses xmlns:xsd="http://www.w3.org/2001/XMLSchema" xmlns:xsi="http://www.w3.org/2001/XMLSchema-instance" xsi:noNamespaceSchemaLocation="CharacterClasses.xsd">
    <CharacterClassData>
        <Name>Amazon</Name>
        <Weight>M</Weight>
        <Symbol>Sword and Shield</Symbol>
        <Description>Amazon</Description>
        <SpecialAdvantages>
            <SpecialAdvantage>Aim</SpecialAdvantage>
            <SpecialAdvantage>Stamina</SpecialAdvantage>
        </SpecialAdvantages>
        <StartingLocations>
            <StartingLocation>Inn</StartingLocation>
        </StartingLocations>
        <TradingRelations>
            <TradingRelation status="friendly">Lancers</TradingRelation>
            <TradingRelation status="friendly">Patrol</TradingRelation>
            <TradingRelation status="friendly">Shaman</TradingRelation>
            <TradingRelation status="unfriendly">Company</TradingRelation>
            <TradingRelation status="unfriendly">Bashkars</TradingRelation>
        </TradingRelations>
        <ClassLevels>
            <ClassLevel>
                <name>Scout</name>
                <Weapon>Light Bow</Weapon>
                <CharacterChit id="1" type="move">M4</CharacterChit>
                <CharacterChit id="2" type="move">M3*</CharacterChit>
                <CharacterChit id="3" type="fight">L4</CharacterChit>
            </ClassLevel>
            <ClassLevel>
                <name>Warrior</name>
                <Weapon>Spear</Weapon>
                <Armor>Helmet</Armor>
                <Armor>Breastplate</Armor>
                <Armor>Shield</Armor>
                <CharacterChit id="4" type="move">M4</CharacterChit>
                <CharacterChit id="5" type="fight">M5</CharacterChit>
                <CharacterChit id="6" type="fight">M4*</CharacterChit>
            </ClassLevel>
            <ClassLevel>
                <name>Champion</name>
                <Weapon>Spear</Weapon>
                <Armor>Helmet</Armor>
                <Armor>Breastplate</Armor>
                <Armor>Shield</Armor>
                <CharacterChit id="7" type="move">M3*</CharacterChit>
                <CharacterChit id="8" type="fight">M3**</CharacterChit>
                <CharacterChit id="9" type="fight">H4**</CharacterChit>
            </ClassLevel>
            <ClassLevel>
                <name>Amazon</name>
                <Weapon>Short Sword</Weapon>
                <Armor>Helmet</Armor>
                <Armor>Breastplate</Armor>
                <Armor>Shield</Armor>
                <CharacterChit id="10" type="fight">M4*</CharacterChit>
                <CharacterChit id="11" type="fight">M3**</CharacterChit>
                <CharacterChit id="12" type="move">M3*</CharacterChit>
            </ClassLevel>
        </ClassLevels>
    </CharacterClassData>
</CharacterClasses>
        
    
    <!--
                <StartingEquipmentList>
                </StartingEquipmentList>
        <Equipment>
            <Weapon>Short Sword</Weapon>
            <Armor>Helmet</Armor>
            <Armor>Breastplate</Armor>
            <Armor>Shield</Armor>
        </Equipment>

    <CharacterClass name="Dwarf" weight="H">
        <Symbol>Opposition</Symbol>

        <StartingLocations>
            <StartingLocation>Inn</StartingLocation>
            <StartingLocation>Guardhouse</StartingLocation>
        </StartingLocations>

        <TradingRelations>
            <TradingRelation status="friendly">Company</TradingRelation>
            <TradingRelation status="friendly">Guard</TradingRelation>
            <TradingRelation status="friendly">Scholar</TradingRelation>
            <TradingRelation status="unfriendly">Woodfolk</TradingRelation>
            <TradingRelation status="unfriendly">Bashkars</TradingRelation>
        </TradingRelations>
        <SpecialAdvantages>
            <SpecialAdvantage>Short Legs</SpecialAdvantage>
            <SpecialAdvantage>Cave Knowledge</SpecialAdvantage>
        </SpecialAdvantages>
        
        <Chits>
            <Chit type="Duck">T3*</Chit>
            <Chit type="Move">H6</Chit>
            <Chit type="Fight">H5*</Chit>
            <Chit type="Move">T6*</Chit>
            <Chit type="Fight">H6</Chit>
            <Chit type="Fight">H4**</Chit>
            <Chit type="Move">H5*</Chit>
            <Chit type="Fight">T6*</Chit>
            <Chit type="Fight">H4**</Chit>
            <Chit type="Fight">T5**</Chit>
            <Chit type="Fight">T5**</Chit>
            <Chit type="Move">T5**</Chit>
        </Chits>

        <Equipment>
            <Weapon>Great Axe</Weapon>
            <Armor>Helmet</Armor>
        </Equipment>

    </CharacterClass>

    <CharacterClass name="Swordsman" weight="L">
        <Symbol>Wolf's Hook</Symbol>

        <StartingLocations>
            <StartingLocation>Inn</StartingLocation>
        </StartingLocations>

        <TradingRelations>
            <TradingRelation status="friendly">Rogues</TradingRelation>
            <TradingRelation status="friendly">Company</TradingRelation>
            <TradingRelation status="friendly">Warlock</TradingRelation>
            <TradingRelation status="Enemy">Patrol</TradingRelation>
        </TradingRelations>

        <SpecialAdvantages>
            <SpecialAdvantage>Barter</SpecialAdvantage>
            <SpecialAdvantage>Clever</SpecialAdvantage>
        </SpecialAdvantages>
        
        <Chits>
            <Chit type="Move">L4</Chit>
            <Chit type="Move">L3*</Chit>
            <Chit type="Fight">L3*</Chit>
            <Chit type="Move">L3*</Chit>
            <Chit type="Fight">L2**</Chit>
            <Chit type="Move">L2**</Chit>
            <Chit type="Move">M4*</Chit>
            <Chit type="Fight">M4*</Chit>
            <Chit type="Fight">M3**</Chit>
            <Chit type="Fight">L4</Chit>
            <Chit type="Fight">M5</Chit>
            <Chit type="Fight">L2**</Chit>
        </Chits>

        <Equipment>
            <Weapon>Thrusting Sword</Weapon>
        </Equipment>

    </CharacterClass>

    <CharacterClass name="White Knight" weight="H">
        <Symbol>"Cross Pommee": Potent Cross</Symbol>

        <StartingLocations>
            <StartingLocation>Inn</StartingLocation>
            <StartingLocation>Chapel</StartingLocation>
        </StartingLocations>

        <TradingRelations>
            <TradingRelation status="Ally">Order</TradingRelation>
            <TradingRelation status="friendly">Lancers</TradingRelation>
            <TradingRelation status="unfriendly">Bashkars</TradingRelation>
            <TradingRelation status="unfriendly">Crone</TradingRelation>
            <TradingRelation status="Enemy">Company</TradingRelation>
        </TradingRelations>

        <SpecialAdvantages>
            <SpecialAdvantage>Health</SpecialAdvantage>
            <SpecialAdvantage>Honor</SpecialAdvantage>
        </SpecialAdvantages>
        
        <Chits>
            <Chit type="Fight">H5*</Chit>
            <Chit type="Fight">H6</Chit>
            <Chit type="Fight">H5*</Chit>
            <Chit type="Fight">H4**</Chit>
            <Chit type="Fight">H6</Chit>
            <Chit type="Fight">H4**</Chit>
            <Chit type="Fight">H4**</Chit>
            <Chit type="Fight">H5*</Chit>
            <Chit type="Magic">I5**</Chit>
            <Chit type="Move">T6*</Chit>
            <Chit type="Fight">T4**</Chit>
            <Chit type="Fight">T5*</Chit>
        </Chits>

        <Equipment>
            <Weapon>Greatsword</Weapon>
            <Armor>Armor</Armor>
            <Spell type="I"></Spell>
        </Equipment>
    </CharacterClass>
-->
